<?xml version="1.0" encoding="UTF-8"?>
<!--
To change this license header, choose License Headers in Project Properties.
To change this template file, choose Tools | Templates
and open the template in the editor.
-->


<biblioteca
    xmlns:xsi='http://www.w3.org/2001/XMLSchema-instance'
    xsi:noNamespaceSchemaLocation='Biblioteca.xsd'>
    <usuarios>
        <usuario>
            <nombre>Kiko</nombre>
            <numLibros>1</numLibros>
            <libro>
                <isb>KJHG9765</isb>
                <titulo>Iliada</titulo>
                <autor>Homero Simpson</autor>
                <numpaginas>567</numpaginas>
                <prestado>true</prestado>
            </libro>
        </usuario>
    </usuarios>
    <libros>
        <libro>
            <isb>KJHG9765</isb>
            <titulo>Iliada</titulo>
            <autor>Homero Simpson</autor>
            <numpaginas>567</numpaginas>
            <prestado>true</prestado>
        </libro>
        <libro>
            <isb>OIUY541</isb>
            <titulo>Titulo1</titulo>
            <autor>Autor1</autor>
            <numpaginas>999</numpaginas>
            <prestado>false</prestado>
        </libro>
    </libros>

</biblioteca>
